{
  "gameInfo": {
    "tournamentName": "2024 WSOP Main Event",
    "eventName": "Final Table",
    "stage": "Final Table",
    "blinds": {
      "smallBlind": 800000,
      "bigBlind": 1600000
    }
  },
  "players": [
    {
      "name": "Griff",
      "nationality": "Unknown",
      "stack": 137000000,
      "cards": [
        "3s",
        "3d"
      ],
      "actions": {
        "preflop": [
          {
            "type": "raise",
            "amount": 3200000
          }
        ],
        "flop": [],
        "turn": [],
        "river": []
      },
      "isWinner": false,
      "amountWon": 0
    },
    {
      "name": "Tamayo",
      "nationality": "Unknown",
      "stack": 23000000,
      "cards": [
        "Kh",
        "Td"
      ],
      "actions": {
        "preflop": [
          {
            "type": "fold",
            "amount": 0
          }
        ],
        "flop": [],
        "turn": [],
        "river": []
      },
      "isWinner": false,
      "amountWon": 0
    },
    {
      "name": "Gonzalez",
      "nationality": "Spain",
      "stack": 14300000,
      "cards": [],
      "actions": {
        "preflop": [],
        "flop": [],
        "turn": [],
        "river": []
      },
      "isWinner": false,
      "amountWon": 0
    }
  ],
  "board": {
    "flop": [],
    "turn": "",
    "river": ""
  },
  "pot": 7200000
}