{
  "gameInfo": {
    "tournamentName": "2024 WSOP Paradise",
    "eventName": "Super Main Event",
    "stage": "Final Table",
    "blinds": {
      "smallBlind": 1500000,
      "bigBlind": 3000000
    }
  },
  "players": [
    {
      "name": "Addamo",
      "nationality": "Australia",
      "stack": 200000000,
      "cards": [
        "Kc",
        "Th"
      ],
      "actions": {
        "preflop": [],
        "flop": [],
        "turn": [],
        "river": []
      },
      "isWinner": false,
      "amountWon": 0
    },
    {
      "name": "Kanit",
      "nationality": "Italy",
      "stack": 139000000,
      "cards": [
        "Ad",
        "Tc"
      ],
      "actions": {
        "preflop": [],
        "flop": [],
        "turn": [],
        "river": []
      },
      "isWinner": false,
      "amountWon": 0
    }
  ],
  "board": {
    "flop": [
      "5s",
      "4c",
      "7d"
    ],
    "turn": "",
    "river": ""
  },
  "pot": 16500000
}