{
  "gameInfo": {
    "tournamentName": "2024 WSOP Paradise",
    "eventName": "Super Main Event",
    "stage": "Final Table",
    "blinds": {
      "smallBlind": 1500000,
      "bigBlind": 3000000
    }
  },
  "players": [
    {
      "name": "Kanit",
      "nationality": "Italy",
      "stack": 139000000,
      "cards": [
        "Ad",
        "Tc"
      ],
      "actions": {
        "preflop": [
          {
            "type": "raise",
            "amount": 6000000
          }
        ],
        "flop": [],
        "turn": [],
        "river": []
      },
      "isWinner": false,
      "amountWon": 0
    },
    {
      "name": "Bonomo",
      "nationality": "USA",
      "stack": 61000000,
      "cards": [
        "Kd",
        "7s"
      ],
      "actions": {
        "preflop": [],
        "flop": [],
        "turn": [],
        "river": []
      },
      "isWinner": false,
      "amountWon": 0
    }
  ],
  "board": {
    "flop": [],
    "turn": "",
    "river": ""
  },
  "pot": 13500000
}