{
  "gameInfo": {
    "tournamentName": "2024 WSOP Paradise",
    "eventName": "Super Main Event",
    "stage": "Final Table",
    "blinds": {
      "smallBlind": 1500000,
      "bigBlind": 3000000
    }
  },
  "players": [
    {
      "name": "Yinan",
      "nationality": "China",
      "stack": 94000000,
      "cards": [
        "Ah",
        "5c"
      ],
      "actions": {
        "preflop": [],
        "flop": [],
        "turn": [],
        "river": []
      },
      "isWinner": false,
      "amountWon": 0
    },
    {
      "name": "Player 2",
      "nationality": "Brazil",
      "stack": 0,
      "cards": [],
      "actions": {
        "preflop": [],
        "flop": [],
        "turn": [],
        "river": []
      },
      "isWinner": false,
      "amountWon": 0
    },
    {
      "name": "Player 3",
      "nationality": "United Kingdom",
      "stack": 0,
      "cards": [],
      "actions": {
        "preflop": [],
        "flop": [],
        "turn": [],
        "river": []
      },
      "isWinner": false,
      "amountWon": 0
    },
    {
      "name": "Player 4",
      "nationality": "Germany",
      "stack": 0,
      "cards": [],
      "actions": {
        "preflop": [],
        "flop": [],
        "turn": [],
        "river": []
      },
      "isWinner": false,
      "amountWon": 0
    }
  ],
  "board": {
    "flop": [
      "As",
      "5d"
    ],
    "turn": "",
    "river": ""
  },
  "pot": 7500000
}