{
  "gameInfo": {
    "tournamentName": "2024 WSOP Paradise",
    "eventName": "Super Main Event",
    "stage": "Final Table",
    "blinds": {
      "smallBlind": 1500000,
      "bigBlind": 3000000
    }
  },
  "players": [
    {
      "name": "LEHMANN",
      "nationality": "German",
      "stack": 30000000,
      "cards": [
        "7h",
        "6d"
      ],
      "actions": {
        "preflop": [],
        "flop": [],
        "turn": [],
        "river": []
      },
      "isWinner": false,
      "amountWon": 0
    }
  ],
  "board": {
    "flop": [],
    "turn": "",
    "river": ""
  },
  "pot": 7500000
}